text,label
Quali sono le caratteristiche principali dell'arte egizia?,Arte Egizia
Come si sono evolute le tecniche di costruzione nel periodo romano?,Architettura Romana
Qual è l'importanza di Pompei per la comprensione della vita quotidiana nell'antica Roma?,Vita Quotidiana Romana
In che modo l'arte greca ha influenzato quella romana?,Influenza Greca nell'Arte Romana
Quali scoperte archeologiche hanno cambiato la nostra comprensione della preistoria?,Scoperte Preistoriche
Come viene utilizzata la datazione al carbonio-14 in archeologia?,Datazione al Carbonio-14
Quali sono le differenze tra l'arte paleocristiana e quella bizantina?,Arte Paleocristiana vs Bizantina
Che ruolo ha avuto l'acquedotto nell'antica civiltà romana?,Acquedotti Romani
Come interpretare le pitture rupestri del Paleolitico?,Pitture Rupestri Paleolitiche
Quali sono stati gli impatti del Rinascimento sulla società europea?,Impatti del Rinascimento
Cosa distingue l'architettura gotica da quella romanica?,Architettura Gotica vs Romanica
In che modo gli scavi di Ercolano hanno contribuito alla nostra conoscenza dell'antichità?,Scavi di Ercolano
Quali tecniche artistiche sono state utilizzate nell'antico Egitto per la realizzazione dei sarcofagi?,Tecniche Artistiche Egizie
Come viene definito il periodo dell'arte barocca e quali sono le sue caratteristiche principali?,Arte Barocca
Qual è il significato dei megaliti di Stonehenge?,Stonehenge
Quali fattori hanno contribuito al declino dell'Impero Romano?,Declino dell'Impero Romano
In che modo la ceramica fornisce informazioni sugli antichi popoli?,Ceramica Antica
Come influenzava la religione l'arte nell'antico Egitto?,Religione e Arte Egizia
Quali sono le principali differenze tra l'arte del Rinascimento e quella del Medioevo?,Rinascimento vs Medioevo
Come venivano realizzati i mosaici bizantini e quale era il loro scopo?,Mosaici Bizantini
In che modo la scoperta di Troia ha influenzato la comprensione dell'Iliade di Omero?,Scoperta di Troia
Quali erano le principali funzioni dei castelli medievali?,Castelli Medievali
Come si distinguono le varie fasi dell'arte greca antica?,Fasi dell'Arte Greca
Quali tecniche venivano utilizzate per la fusione del bronzo nella statuaria greca?,Fusione del Bronzo nella Statuaria Greca
Quali sono stati i principali centri culturali dell'arte rinascimentale?,Centri Culturali del Rinascimento
In che modo l'analisi dei pigmenti aiuta a comprendere le tecniche pittoriche antiche?,Analisi dei Pigmenti
Qual è stata l'importanza degli scavi di Mycenae per la comprensione della civiltà micenea?,Scavi di Mycenae
Come si differenziano le tombe etrusche da quelle romane?,Tombe Etrusche vs Romane
In che modo l'arte romana rifletteva la società e i valori dell'epoca?,Arte Romana e Società
Quali sono le principali caratteristiche dell'architettura mesopotamica?,Architettura Mesopotamica
Come veniva rappresentata la figura umana nell'arte cicladica?,Arte Cicladica
Quali sono le principali fonti per lo studio della storia dell'arte dell'antica Grecia?,Fonti Storiche dell'Arte Greca
Quali erano le funzioni sociali e religiose dell'arte nella società Maya?,Arte Maya
In che modo le armi e gli strumenti vengono utilizzati per datare i siti archeologici?,Datazione dei Siti Archeologici
Qual è il significato simbolico dei colori nell'arte egizia?,Simbolismo dei Colori nell'Arte Egizia
Come l'uso dei materiali influenzava lo stile artistico nell'antichità?,Materiali e Stile Artistico Antico
Quali sono le principali differenze tra l'architettura classica e quella neoclassica?,Classica vs Neoclassica
Come venivano selezionati e utilizzati i siti per la costruzione dei templi greci?,Costruzione dei Templi Greci
Qual è stato l'impatto dell'invenzione della stampa sull'arte e sulla cultura?,Invenzione della Stampa
Come venivano realizzate e utilizzate le monete nell'antica Roma?,Monete nell'Antica Roma
Qual è l'importanza dei ritrovamenti di Akrotiri per la comprensione della civiltà minoica?,Ritrovamenti di Akrotiri
In che modo l'arte e l'architettura riflettono il potere e la religione nell'Impero Bizantino?,Arte e Architettura Bizantina
Come l'analisi del DNA sta cambiando la nostra comprensione delle migrazioni antiche?,Analisi del DNA e Migrazioni Antiche
Quali tecniche di conservazione sono utilizzate per preservare le opere d'arte antiche?,Tecniche di Conservazione
In che modo l'arte dell'antico Egitto è stata influenzata dalla sua geografia?,Influenza della Geografia sull'Arte Egizia
Quali erano le principali tecniche di scultura utilizzate nella Grecia antica?,Tecniche di Scultura nella Grecia Antica
Come si sono sviluppate le città-stato nella Grecia antica e quale era il loro ruolo nella società?,Città-Stato nella Grecia Antica
Quali fattori hanno influenzato lo sviluppo dell'architettura gotica?,Sviluppo dell'Architettura Gotica
In che modo gli affreschi di Pompei ci forniscono informazioni sulla vita e l'arte dell'epoca?,Affreschi di Pompei
Quali sono le principali caratteristiche delle sculture dell'arte romanica?,Sculture dell'Arte Romanica
Come l'arte ha influenzato la politica nell'antica Grecia?,Arte e Politica nell'Antica Grecia
Quali sono le tecniche di navigazione e mappatura utilizzate dalle antiche civiltà marinare?,Navigazione e Mappatura Antiche
Come l'arte rupestre può essere interpretata per comprendere le culture preistoriche?,Interpretazione dell'Arte Rupestre
Quali sono state le influenze culturali sull'arte della Mesopotamia?,Influenze Culturali sull'Arte Mesopotamica
In che modo le tecniche di restauro moderne possono influenzare la percezione delle opere d'arte antiche?,Tecniche di Restauro Moderne
Qual è stata l'importanza della Via della Seta per lo scambio culturale e artistico?,Importanza della Via della Seta
Quale innovazione nell'architettura romana ha permesso la costruzione di grandi spazi interni coperti?,Architettura Romana
Qual è una differenza principale tra l'arte classica greco-romana e quella neoclassica?,Classica vs Neoclassica
Quale metodo di datazione è comunemente utilizzato per determinare l'età di siti archeologici antichi?,Datazione dei Siti Archeologici
Qual è stata una delle cause principali del declino dell'Impero Romano d'Occidente?,Declino dell'Impero Romano
Qual era la tecnica predominante utilizzata dai Greci antichi per la fusione delle statue in bronzo?,Fusione del Bronzo nella Statuaria Greca
Qual era la principale funzione delle monete nell'antica Roma?,Monete nell'Antica Roma
Chi è accreditato per la scoperta del sito archeologico di Troia?,Scoperta di Troia
